{
  "formatVersion": 1,
  "name": "Moss",
  "rig": "bean-1",
  "body": "#A9BB82",
  "belly": "#E4E9CC",
  "ink": "#263B32",
  "accent": "#EBA18E",
  "width": 66,
  "height": 74,
  "earLength": 23,
  "personality": {
    "curiosity": 0.75,
    "playfulness": 0.7,
    "sociability": 0.65,
    "calmness": 0.5
  },
  "animations": {
    "Idle": {
      "rate": 1,
      "bob": 0.6,
      "lean": 0,
      "crouch": 0,
      "eyes": 1,
      "ears": 0,
      "arms": 0,
      "duration": 1,
      "loop": true,
      "markers": []
    },
    "Walking": {
      "rate": 2.3,
      "bob": 2,
      "lean": 2,
      "crouch": 0,
      "eyes": 1,
      "ears": 0,
      "arms": 0,
      "duration": 1,
      "loop": true,
      "markers": []
    },
    "Running": {
      "rate": 4,
      "bob": 3,
      "lean": 5,
      "crouch": 0,
      "eyes": 1,
      "ears": 0,
      "arms": 2,
      "duration": 1,
      "loop": true,
      "markers": []
    },
    "Jumping": {
      "rate": 1,
      "bob": 0,
      "lean": 0,
      "crouch": -0.12,
      "eyes": 1,
      "ears": -0.4,
      "arms": 3,
      "duration": 0.45,
      "loop": false,
      "markers": []
    },
    "Falling": {
      "rate": 1,
      "bob": 0,
      "lean": 0,
      "crouch": -0.06,
      "eyes": 1,
      "ears": 0.45,
      "arms": 4,
      "duration": 1,
      "loop": true,
      "markers": []
    },
    "Climbing": {
      "rate": 2.5,
      "bob": 1,
      "lean": 8,
      "crouch": 0,
      "eyes": 1,
      "ears": 0,
      "arms": 5,
      "duration": 1,
      "loop": true,
      "markers": []
    },
    "Sitting": {
      "rate": 0.5,
      "bob": 0.6,
      "lean": 0,
      "crouch": 0.17,
      "eyes": 0.8,
      "ears": 0,
      "arms": 0,
      "duration": 1,
      "loop": true,
      "markers": []
    },
    "Sleeping": {
      "rate": 0.25,
      "bob": 0.6,
      "lean": 0,
      "crouch": 0.4,
      "eyes": 0.04,
      "ears": 0.6,
      "arms": 0,
      "duration": 1,
      "loop": true,
      "markers": []
    },
    "Waking": {
      "rate": 1,
      "bob": 0.6,
      "lean": 0,
      "crouch": 0.1,
      "eyes": 1,
      "ears": -0.25,
      "arms": 4,
      "duration": 1.2,
      "loop": false,
      "markers": []
    },
    "Looking": {
      "rate": 1,
      "bob": 0.6,
      "lean": -5,
      "crouch": 0,
      "eyes": 1,
      "ears": -0.15,
      "arms": 0,
      "duration": 1,
      "loop": true,
      "markers": []
    },
    "Reacting": {
      "rate": 1,
      "bob": 2,
      "lean": 0,
      "crouch": 0,
      "eyes": 1,
      "ears": -0.3,
      "arms": 0,
      "duration": 0.8,
      "loop": false,
      "markers": []
    },
    "Dancing": {
      "rate": 2,
      "bob": 4,
      "lean": -3,
      "crouch": 0.06,
      "eyes": 1,
      "ears": 0.2,
      "arms": 5,
      "duration": 1,
      "loop": true,
      "markers": []
    },
    "Petted": {
      "rate": 1.5,
      "bob": 0.6,
      "lean": 0,
      "crouch": 0.1,
      "eyes": 0.1,
      "ears": 0.4,
      "arms": 0,
      "duration": 1.3,
      "loop": false,
      "markers": []
    },
    "Grabbed": {
      "rate": 1,
      "bob": 0.6,
      "lean": 0,
      "crouch": -0.1,
      "eyes": 1,
      "ears": 0.5,
      "arms": 5,
      "duration": 0.22,
      "loop": false,
      "markers": []
    },
    "Held": {
      "rate": 1.3,
      "bob": 1,
      "lean": 0,
      "crouch": -0.12,
      "eyes": 1,
      "ears": 0.5,
      "arms": 2,
      "duration": 1,
      "loop": true,
      "markers": []
    },
    "Thrown": {
      "rate": 1,
      "bob": 0.6,
      "lean": 0,
      "crouch": -0.1,
      "eyes": 1,
      "ears": 0.7,
      "arms": 5,
      "duration": 0.3,
      "loop": false,
      "markers": []
    },
    "Airborne": {
      "rate": 1,
      "bob": 0,
      "lean": 0,
      "crouch": 0,
      "eyes": 1,
      "ears": 0,
      "arms": 3,
      "duration": 1,
      "loop": true,
      "markers": []
    },
    "Impact": {
      "rate": 1,
      "bob": 0,
      "lean": 0,
      "crouch": 0.4,
      "eyes": 0.1,
      "ears": 0,
      "arms": 3,
      "duration": 0.25,
      "loop": false,
      "markers": []
    },
    "Recovery": {
      "rate": 1,
      "bob": 0.6,
      "lean": 0,
      "crouch": 0.15,
      "eyes": 0.6,
      "ears": 0,
      "arms": 0,
      "duration": 0.5,
      "loop": false,
      "markers": []
    },
    "Startled": {
      "rate": 1,
      "bob": 1,
      "lean": 0,
      "crouch": 0,
      "eyes": 1,
      "ears": -0.3,
      "arms": 4,
      "duration": 0.8,
      "loop": false,
      "markers": []
    },
    "Hiding": {
      "rate": 1,
      "bob": 0.6,
      "lean": 0,
      "crouch": 0.35,
      "eyes": 0.5,
      "ears": 0,
      "arms": 3,
      "duration": 1,
      "loop": true,
      "markers": []
    },
    "Investigating": {
      "rate": 1.8,
      "bob": 1,
      "lean": 7,
      "crouch": 0,
      "eyes": 1,
      "ears": -0.2,
      "arms": 0,
      "duration": 1,
      "loop": true,
      "markers": []
    },
    "Celebrating": {
      "rate": 3,
      "bob": 4,
      "lean": 0,
      "crouch": 0,
      "eyes": 1,
      "ears": 0.2,
      "arms": 6,
      "duration": 1.4,
      "loop": true,
      "markers": [
        0.2,
        0.7
      ]
    },
    "Hanging": {
      "rate": 1.2,
      "bob": 0.4,
      "lean": 0,
      "crouch": 0.08,
      "eyes": 1,
      "ears": 0.1,
      "arms": 2.5,
      "duration": 1.6,
      "loop": true,
      "markers": []
    },
    "Carrying": {
      "rate": 2,
      "bob": 1.6,
      "lean": 1.5,
      "crouch": 0.05,
      "eyes": 1,
      "ears": 0,
      "arms": 1.8,
      "duration": 1,
      "loop": true,
      "markers": []
    },
    "Hammering": {
      "rate": 3.2,
      "bob": 2.2,
      "lean": 1,
      "crouch": 0.12,
      "eyes": 1,
      "ears": 0,
      "arms": 3,
      "duration": 0.9,
      "loop": true,
      "markers": [0.5]
    },
    "Peeking": {
      "rate": 0.8,
      "bob": 0.3,
      "lean": 2,
      "crouch": 0,
      "eyes": 1,
      "ears": 1,
      "arms": 0,
      "duration": 2.2,
      "loop": true,
      "markers": []
    },
    "Balancing": {
      "rate": 1.4,
      "bob": 1.2,
      "lean": 0,
      "crouch": 0.15,
      "eyes": 1,
      "ears": 0.3,
      "arms": 2.2,
      "duration": 1.2,
      "loop": true,
      "markers": []
    }
  },
  "headphones": true,
  "sound": {
    "frequency": 430,
    "decay": 65,
    "volume": 0.06
  }
}
