{
  "formatVersion": 1,
  "name": "Lark",
  "rig": "bean-1",
  "body": "#8BA6AE",
  "belly": "#E8E8CC",
  "ink": "#263B32",
  "accent": "#DCAA5F",
  "width": 55,
  "height": 62,
  "earLength": 12,
  "personality": {
    "curiosity": 0.95,
    "playfulness": 0.7,
    "sociability": 0.55,
    "calmness": 0.35
  },
  "animations": {
    "Idle": {
      "rate": 1,
      "bob": 0.6,
      "lean": 0,
      "crouch": 0,
      "eyes": 1,
      "ears": 0,
      "arms": 0,
      "duration": 1,
      "loop": true,
      "markers": []
    },
    "Walking": {
      "rate": 3.2,
      "bob": 3.5,
      "lean": 2,
      "crouch": 0,
      "eyes": 1,
      "ears": 0,
      "arms": 0,
      "duration": 1,
      "loop": true,
      "markers": []
    },
    "Running": {
      "rate": 4,
      "bob": 3,
      "lean": 5,
      "crouch": 0,
      "eyes": 1,
      "ears": 0,
      "arms": 2,
      "duration": 1,
      "loop": true,
      "markers": []
    },
    "Jumping": {
      "rate": 1,
      "bob": 0,
      "lean": 0,
      "crouch": -0.12,
      "eyes": 1,
      "ears": -0.4,
      "arms": 3,
      "duration": 0.45,
      "loop": false,
      "markers": []
    },
    "Falling": {
      "rate": 1,
      "bob": 0,
      "lean": 0,
      "crouch": -0.06,
      "eyes": 1,
      "ears": 0.45,
      "arms": 4,
      "duration": 1,
      "loop": true,
      "markers": []
    },
    "Climbing": {
      "rate": 3.2,
      "bob": 1,
      "lean": 8,
      "crouch": 0,
      "eyes": 1,
      "ears": 0,
      "arms": 6,
      "duration": 1,
      "loop": true,
      "markers": []
    },
    "Sitting": {
      "rate": 0.5,
      "bob": 0.6,
      "lean": 0,
      "crouch": 0.17,
      "eyes": 0.8,
      "ears": 0,
      "arms": 0,
      "duration": 1,
      "loop": true,
      "markers": []
    },
    "Sleeping": {
      "rate": 0.25,
      "bob": 0.6,
      "lean": 0,
      "crouch": 0.4,
      "eyes": 0.04,
      "ears": 0.6,
      "arms": 0,
      "duration": 1,
      "loop": true,
      "markers": []
    },
    "Waking": {
      "rate": 1,
      "bob": 0.6,
      "lean": 0,
      "crouch": 0.1,
      "eyes": 1,
      "ears": -0.25,
      "arms": 4,
      "duration": 1.2,
      "loop": false,
      "markers": []
    },
    "Looking": {
      "rate": 1,
      "bob": 0.6,
      "lean": -5,
      "crouch": 0,
      "eyes": 1,
      "ears": -0.15,
      "arms": 0,
      "duration": 1,
      "loop": true,
      "markers": []
    },
    "Reacting": {
      "rate": 1,
      "bob": 2,
      "lean": 0,
      "crouch": 0,
      "eyes": 1,
      "ears": -0.3,
      "arms": 0,
      "duration": 0.8,
      "loop": false,
      "markers": []
    },
    "Dancing": {
      "rate": 2.8,
      "bob": 3,
      "lean": -3,
      "crouch": 0.06,
      "eyes": 1,
      "ears": 0.2,
      "arms": 6,
      "duration": 1,
      "loop": true,
      "markers": []
    },
    "Petted": {
      "rate": 1.5,
      "bob": 0.6,
      "lean": 0,
      "crouch": 0.1,
      "eyes": 0.1,
      "ears": 0.4,
      "arms": 0,
      "duration": 1.3,
      "loop": false,
      "markers": []
    },
    "Grabbed": {
      "rate": 1,
      "bob": 0.6,
      "lean": 0,
      "crouch": -0.1,
      "eyes": 1,
      "ears": 0.5,
      "arms": 5,
      "duration": 0.22,
      "loop": false,
      "markers": []
    },
    "Held": {
      "rate": 1.3,
      "bob": 1,
      "lean": 0,
      "crouch": -0.12,
      "eyes": 1,
      "ears": 0.5,
      "arms": 2,
      "duration": 1,
      "loop": true,
      "markers": []
    },
    "Thrown": {
      "rate": 1,
      "bob": 0.6,
      "lean": 0,
      "crouch": -0.1,
      "eyes": 1,
      "ears": 0.7,
      "arms": 5,
      "duration": 0.3,
      "loop": false,
      "markers": []
    },
    "Airborne": {
      "rate": 1,
      "bob": 0,
      "lean": 0,
      "crouch": 0,
      "eyes": 1,
      "ears": 0,
      "arms": 3,
      "duration": 1,
      "loop": true,
      "markers": []
    },
    "Impact": {
      "rate": 1,
      "bob": 0,
      "lean": 0,
      "crouch": 0.4,
      "eyes": 0.1,
      "ears": 0,
      "arms": 3,
      "duration": 0.25,
      "loop": false,
      "markers": []
    },
    "Recovery": {
      "rate": 1,
      "bob": 0.6,
      "lean": 0,
      "crouch": 0.15,
      "eyes": 0.6,
      "ears": 0,
      "arms": 0,
      "duration": 0.5,
      "loop": false,
      "markers": []
    },
    "Startled": {
      "rate": 1,
      "bob": 1,
      "lean": 0,
      "crouch": 0,
      "eyes": 1,
      "ears": -0.3,
      "arms": 4,
      "duration": 0.8,
      "loop": false,
      "markers": []
    },
    "Hiding": {
      "rate": 1,
      "bob": 0.6,
      "lean": 0,
      "crouch": 0.35,
      "eyes": 0.5,
      "ears": 0,
      "arms": 3,
      "duration": 1,
      "loop": true,
      "markers": []
    },
    "Investigating": {
      "rate": 1.8,
      "bob": 1,
      "lean": 7,
      "crouch": 0,
      "eyes": 1,
      "ears": -0.2,
      "arms": 0,
      "duration": 1,
      "loop": true,
      "markers": []
    },
    "Celebrating": {
      "rate": 3,
      "bob": 4,
      "lean": 0,
      "crouch": 0,
      "eyes": 1,
      "ears": 0.2,
      "arms": 6,
      "duration": 1.4,
      "loop": true,
      "markers": [
        0.2,
        0.7
      ]
    }
  },
  "headphones": true,
  "sound": {
    "frequency": 920,
    "decay": 110,
    "volume": 0.045
  },
  "species": "bird",
  "paper": "#F2F3DF",
  "musicProp": "radio"
}
