{
  "formatVersion": 1,
  "name": "Wren",
  "rig": "bean-1",
  "body": "#7288A0",
  "belly": "#ECE5CB",
  "ink": "#2E3A45",
  "accent": "#D99A4A",
  "width": 58,
  "height": 64,
  "earLength": 8,
  "personality": {
    "curiosity": 0.9,
    "playfulness": 0.75,
    "sociability": 0.6,
    "calmness": 0.4
  },
  "animations": {
    "Idle": {
      "rate": 1,
      "bob": 0.6,
      "lean": 0,
      "crouch": 0,
      "eyes": 1,
      "ears": 0,
      "arms": 0,
      "duration": 1,
      "loop": true,
      "markers": [],
      "frames": [
        "Idle#0"
      ]
    },
    "Walking": {
      "rate": 3.0,
      "bob": 3.2,
      "lean": 2,
      "crouch": 0,
      "eyes": 1,
      "ears": 0,
      "arms": 0,
      "duration": 1,
      "loop": true,
      "markers": [],
      "frames": [
        "Walking#0",
        "Walking#1",
        "Walking#2"
      ]
    },
    "Running": {
      "rate": 4.2,
      "bob": 3.2,
      "lean": 5,
      "crouch": 0,
      "eyes": 1,
      "ears": 0,
      "arms": 2,
      "duration": 1,
      "loop": true,
      "markers": [],
      "frames": [
        "Running#0",
        "Running#1"
      ]
    },
    "Jumping": {
      "rate": 1,
      "bob": 0,
      "lean": 0,
      "crouch": -0.12,
      "eyes": 1,
      "ears": -0.4,
      "arms": 3,
      "duration": 0.45,
      "loop": false,
      "markers": [],
      "frames": [
        "Jumping#0"
      ]
    },
    "Falling": {
      "rate": 1,
      "bob": 0,
      "lean": 0,
      "crouch": -0.06,
      "eyes": 1,
      "ears": 0.45,
      "arms": 4,
      "duration": 1,
      "loop": true,
      "markers": [],
      "frames": [
        "Falling#0",
        "Falling#1",
        "Falling#2"
      ]
    },
    "Climbing": {
      "rate": 3.0,
      "bob": 1,
      "lean": 8,
      "crouch": 0,
      "eyes": 1,
      "ears": 0,
      "arms": 6,
      "duration": 1,
      "loop": true,
      "markers": [],
      "frames": [
        "Climbing#0",
        "Climbing#1"
      ]
    },
    "Sitting": {
      "rate": 0.5,
      "bob": 0.6,
      "lean": 0,
      "crouch": 0.17,
      "eyes": 0.8,
      "ears": 0,
      "arms": 0,
      "duration": 1,
      "loop": true,
      "markers": [],
      "frames": [
        "Sitting#0"
      ]
    },
    "Sleeping": {
      "rate": 0.25,
      "bob": 0.6,
      "lean": 0,
      "crouch": 0.4,
      "eyes": 0.04,
      "ears": 0.6,
      "arms": 0,
      "duration": 1,
      "loop": true,
      "markers": [],
      "frames": [
        "Sleeping#0",
        "Sleeping#1"
      ]
    },
    "Waking": {
      "rate": 1,
      "bob": 0.6,
      "lean": 0,
      "crouch": 0.1,
      "eyes": 1,
      "ears": -0.25,
      "arms": 4,
      "duration": 1.2,
      "loop": false,
      "markers": [],
      "frames": [
        "Waking#0"
      ]
    },
    "Looking": {
      "rate": 1,
      "bob": 0.6,
      "lean": -5,
      "crouch": 0,
      "eyes": 1,
      "ears": -0.15,
      "arms": 0,
      "duration": 1,
      "loop": true,
      "markers": [],
      "frames": [
        "Looking#0"
      ]
    },
    "Reacting": {
      "rate": 1,
      "bob": 2,
      "lean": 0,
      "crouch": 0,
      "eyes": 1,
      "ears": -0.3,
      "arms": 0,
      "duration": 0.8,
      "loop": false,
      "markers": [],
      "frames": [
        "Reacting#0"
      ]
    },
    "Dancing": {
      "rate": 3.0,
      "bob": 3,
      "lean": -3,
      "crouch": 0.06,
      "eyes": 1,
      "ears": 0.2,
      "arms": 6,
      "duration": 1,
      "loop": true,
      "markers": [],
      "frames": [
        "Dancing#0",
        "Dancing#1",
        "Dancing#2"
      ]
    },
    "Petted": {
      "rate": 1.5,
      "bob": 0.6,
      "lean": 0,
      "crouch": 0.1,
      "eyes": 0.1,
      "ears": 0.4,
      "arms": 0,
      "duration": 1.3,
      "loop": false,
      "markers": [],
      "frames": [
        "Petted#0"
      ]
    },
    "Grabbed": {
      "rate": 1,
      "bob": 0.6,
      "lean": 0,
      "crouch": -0.1,
      "eyes": 1,
      "ears": 0.5,
      "arms": 5,
      "duration": 0.22,
      "loop": false,
      "markers": [],
      "frames": [
        "Startled#0"
      ]
    },
    "Held": {
      "rate": 1.3,
      "bob": 1,
      "lean": 0,
      "crouch": -0.12,
      "eyes": 1,
      "ears": 0.5,
      "arms": 2,
      "duration": 1,
      "loop": true,
      "markers": [],
      "frames": [
        "Held#0"
      ]
    },
    "Thrown": {
      "rate": 1,
      "bob": 0.6,
      "lean": 0,
      "crouch": -0.1,
      "eyes": 1,
      "ears": 0.7,
      "arms": 5,
      "duration": 0.3,
      "loop": false,
      "markers": [],
      "frames": [
        "Thrown#0",
        "Thrown#1",
        "Thrown#2"
      ]
    },
    "Airborne": {
      "rate": 1,
      "bob": 0,
      "lean": 0,
      "crouch": 0,
      "eyes": 1,
      "ears": 0,
      "arms": 3,
      "duration": 1,
      "loop": true,
      "markers": [],
      "frames": [
        "Airborne#0"
      ]
    },
    "Impact": {
      "rate": 1,
      "bob": 0,
      "lean": 0,
      "crouch": 0.4,
      "eyes": 0.1,
      "ears": 0,
      "arms": 3,
      "duration": 0.25,
      "loop": false,
      "markers": [],
      "frames": [
        "Impact#0"
      ]
    },
    "Recovery": {
      "rate": 1,
      "bob": 0.6,
      "lean": 0,
      "crouch": 0.15,
      "eyes": 0.6,
      "ears": 0,
      "arms": 0,
      "duration": 0.5,
      "loop": false,
      "markers": [],
      "frames": [
        "Recovery#0"
      ]
    },
    "Startled": {
      "rate": 1,
      "bob": 1,
      "lean": 0,
      "crouch": 0,
      "eyes": 1,
      "ears": -0.3,
      "arms": 4,
      "duration": 0.8,
      "loop": false,
      "markers": [],
      "frames": [
        "Startled#0"
      ]
    },
    "Hiding": {
      "rate": 1,
      "bob": 0.6,
      "lean": 0,
      "crouch": 0.35,
      "eyes": 0.5,
      "ears": 0,
      "arms": 3,
      "duration": 1,
      "loop": true,
      "markers": [],
      "frames": [
        "Sitting#0"
      ]
    },
    "Investigating": {
      "rate": 1.8,
      "bob": 1,
      "lean": 7,
      "crouch": 0,
      "eyes": 1,
      "ears": -0.2,
      "arms": 0,
      "duration": 1,
      "loop": true,
      "markers": [],
      "frames": [
        "Investigating#0",
        "Investigating#1"
      ]
    },
    "Celebrating": {
      "rate": 3,
      "bob": 4,
      "lean": 0,
      "crouch": 0,
      "eyes": 1,
      "ears": 0.2,
      "arms": 6,
      "duration": 1.4,
      "loop": true,
      "markers": [
        0.2,
        0.7
      ],
      "frames": [
        "Celebrating#0"
      ]
    },
    "Hanging": {
      "rate": 1.32,
      "bob": 0.4,
      "lean": 0,
      "crouch": 0.08,
      "eyes": 1,
      "ears": 0.1,
      "arms": 2.5,
      "duration": 1.6,
      "loop": true,
      "markers": [],
      "frames": [
        "Hanging#0"
      ]
    },
    "Carrying": {
      "rate": 2.2,
      "bob": 1.6,
      "lean": 1.5,
      "crouch": 0.05,
      "eyes": 1,
      "ears": 0,
      "arms": 1.8,
      "duration": 1,
      "loop": true,
      "markers": [],
      "frames": [
        "Carrying#0",
        "Carrying#1"
      ]
    },
    "Hammering": {
      "rate": 3.52,
      "bob": 2.2,
      "lean": 1,
      "crouch": 0.12,
      "eyes": 1,
      "ears": 0,
      "arms": 3,
      "duration": 0.9,
      "loop": true,
      "markers": [
        0.5
      ],
      "frames": [
        "Hammering#0",
        "Hammering#1"
      ]
    },
    "Peeking": {
      "rate": 0.88,
      "bob": 0.3,
      "lean": 2,
      "crouch": 0,
      "eyes": 1,
      "ears": 1,
      "arms": 0,
      "duration": 2.2,
      "loop": true,
      "markers": [],
      "frames": [
        "Peeking#0"
      ]
    },
    "Balancing": {
      "rate": 1.54,
      "bob": 1.2,
      "lean": 0,
      "crouch": 0.15,
      "eyes": 1,
      "ears": 0.3,
      "arms": 2.2,
      "duration": 1.2,
      "loop": true,
      "markers": [],
      "frames": [
        "Balancing#0"
      ]
    }
  },
  "headphones": true,
  "sound": {
    "frequency": 880,
    "decay": 105,
    "volume": 0.045
  },
  "species": "bird",
  "paper": "#F2F3DF",
  "musicProp": "headphones",
  "spriteAtlas": {
    "atlasFile": "atlas.json",
    "source": "Moss Bird Asset .png",
    "sourceWidth": 2816,
    "sourceHeight": 1536,
    "hasAlpha": true,
    "mode": "packed"
  }
}
